[
 {
  "signal_id": "sig-20261026-pinterest-trends-trend-rank-001-top-gunner-outfit-hallow",
  "source": "pinterest_trends",
  "is_estimate": true,
  "keyword": "top gunner outfit halloween",
  "niche": "unassigned",
  "metric": "trend_rank",
  "value": 1.0,
  "unit": "rank",
  "window_start": "2026-10-26",
  "window_end": "2026-10-26",
  "fetched_at": "2026-10-26T13:04:42+00:00",
  "raw_ref": "data/inbox/2026-10-26/pinterest_trends.csv",
  "license": "owner export, internal use"
 },
 {
  "signal_id": "sig-20261026-pinterest-trends-growth-wow-001-top-gunner-outfit-hallow",
  "source": "pinterest_trends",
  "is_estimate": true,
  "keyword": "top gunner outfit halloween",
  "niche": "unassigned",
  "metric": "growth_wow",
  "value": 0.3,
  "unit": "ratio",
  "window_start": "2026-10-19",
  "window_end": "2026-10-26",
  "fetched_at": "2026-10-26T13:04:42+00:00",
  "raw_ref": "data/inbox/2026-10-26/pinterest_trends.csv",
  "license": "owner export, internal use"
 },
 {
  "signal_id": "sig-20261026-pinterest-trends-growth-mom-001-top-gunner-outfit-hallow",
  "source": "pinterest_trends",
  "is_estimate": true,
  "keyword": "top gunner outfit halloween",
  "niche": "unassigned",
  "metric": "growth_mom",
  "value": 100.0,
  "unit": "ratio",
  "window_start": "2026-09-26",
  "window_end": "2026-10-26",
  "fetched_at": "2026-10-26T13:04:42+00:00",
  "raw_ref": "data/inbox/2026-10-26/pinterest_trends.csv",
  "license": "owner export, internal use"
 },
 {
  "signal_id": "sig-20261026-pinterest-trends-growth-yoy-001-top-gunner-outfit-hallow",
  "source": "pinterest_trends",
  "is_estimate": true,
  "keyword": "top gunner outfit halloween",
  "niche": "unassigned",
  "metric": "growth_yoy",
  "value": 100.0,
  "unit": "ratio",
  "window_start": "2025-10-26",
  "window_end": "2026-10-26",
  "fetched_at": "2026-10-26T13:04:42+00:00",
  "raw_ref": "data/inbox/2026-10-26/pinterest_trends.csv",
  "license": "owner export, internal use"
 },
 {
  "signal_id": "sig-20261026-pinterest-trends-trend-rank-002-pumkin-carvings-ideas",
  "source": "pinterest_trends",
  "is_estimate": true,
  "keyword": "pumkin carvings ideas",
  "niche": "unassigned",
  "metric": "trend_rank",
  "value": 2.0,
  "unit": "rank",
  "window_start": "2026-10-26",
  "window_end": "2026-10-26",
  "fetched_at": "2026-10-26T13:04:42+00:00",
  "raw_ref": "data/inbox/2026-10-26/pinterest_trends.csv",
  "license": "owner export, internal use"
 },
 {
  "signal_id": "sig-20261026-pinterest-trends-growth-wow-002-pumkin-carvings-ideas",
  "source": "pinterest_trends",
  "is_estimate": true,
  "keyword": "pumkin carvings ideas",
  "niche": "unassigned",
  "metric": "growth_wow",
  "value": 2.0,
  "unit": "ratio",
  "window_start": "2026-10-19",
  "window_end": "2026-10-26",
  "fetched_at": "2026-10-26T13:04:42+00:00",
  "raw_ref": "data/inbox/2026-10-26/pinterest_trends.csv",
  "license": "owner export, internal use"
 },
 {
  "signal_id": "sig-20261026-pinterest-trends-growth-mom-002-pumkin-carvings-ideas",
  "source": "pinterest_trends",
  "is_estimate": true,
  "keyword": "pumkin carvings ideas",
  "niche": "unassigned",
  "metric": "growth_mom",
  "value": 100.0,
  "unit": "ratio",
  "window_start": "2026-09-26",
  "window_end": "2026-10-26",
  "fetched_at": "2026-10-26T13:04:42+00:00",
  "raw_ref": "data/inbox/2026-10-26/pinterest_trends.csv",
  "license": "owner export, internal use"
 },
 {
  "signal_id": "sig-20261026-pinterest-trends-growth-yoy-002-pumkin-carvings-ideas",
  "source": "pinterest_trends",
  "is_estimate": true,
  "keyword": "pumkin carvings ideas",
  "niche": "unassigned",
  "metric": "growth_yoy",
  "value": 6.0,
  "unit": "ratio",
  "window_start": "2025-10-26",
  "window_end": "2026-10-26",
  "fetched_at": "2026-10-26T13:04:42+00:00",
  "raw_ref": "data/inbox/2026-10-26/pinterest_trends.csv",
  "license": "owner export, internal use"
 },
 {
  "signal_id": "sig-20261026-pinterest-trends-trend-rank-003-cold-pumpkin-patch-outfi",
  "source": "pinterest_trends",
  "is_estimate": true,
  "keyword": "cold pumpkin patch outfit",
  "niche": "unassigned",
  "metric": "trend_rank",
  "value": 3.0,
  "unit": "rank",
  "window_start": "2026-10-26",
  "window_end": "2026-10-26",
  "fetched_at": "2026-10-26T13:04:42+00:00",
  "raw_ref": "data/inbox/2026-10-26/pinterest_trends.csv",
  "license": "owner export, internal use"
 },
 {
  "signal_id": "sig-20261026-pinterest-trends-growth-wow-003-cold-pumpkin-patch-outfi",
  "source": "pinterest_trends",
  "is_estimate": true,
  "keyword": "cold pumpkin patch outfit",
  "niche": "unassigned",
  "metric": "growth_wow",
  "value": 2.0,
  "unit": "ratio",
  "window_start": "2026-10-19",
  "window_end": "2026-10-26",
  "fetched_at": "2026-10-26T13:04:42+00:00",
  "raw_ref": "data/inbox/2026-10-26/pinterest_trends.csv",
  "license": "owner export, internal use"
 },
 {
  "signal_id": "sig-20261026-pinterest-trends-growth-mom-003-cold-pumpkin-patch-outfi",
  "source": "pinterest_trends",
  "is_estimate": true,
  "keyword": "cold pumpkin patch outfit",
  "niche": "unassigned",
  "metric": "growth_mom",
  "value": 100.0,
  "unit": "ratio",
  "window_start": "2026-09-26",
  "window_end": "2026-10-26",
  "fetched_at": "2026-10-26T13:04:42+00:00",
  "raw_ref": "data/inbox/2026-10-26/pinterest_trends.csv",
  "license": "owner export, internal use"
 },
 {
  "signal_id": "sig-20261026-pinterest-trends-growth-yoy-003-cold-pumpkin-patch-outfi",
  "source": "pinterest_trends",
  "is_estimate": true,
  "keyword": "cold pumpkin patch outfit",
  "niche": "unassigned",
  "metric": "growth_yoy",
  "value": 4.0,
  "unit": "ratio",
  "window_start": "2025-10-26",
  "window_end": "2026-10-26",
  "fetched_at": "2026-10-26T13:04:42+00:00",
  "raw_ref": "data/inbox/2026-10-26/pinterest_trends.csv",
  "license": "owner export, internal use"
 },
 {
  "signal_id": "sig-20261026-pinterest-trends-trend-rank-004-roman-cyberpunk",
  "source": "pinterest_trends",
  "is_estimate": true,
  "keyword": "roman cyberpunk",
  "niche": "unassigned",
  "metric": "trend_rank",
  "value": 4.0,
  "unit": "rank",
  "window_start": "2026-10-26",
  "window_end": "2026-10-26",
  "fetched_at": "2026-10-26T13:04:42+00:00",
  "raw_ref": "data/inbox/2026-10-26/pinterest_trends.csv",
  "license": "owner export, internal use"
 },
 {
  "signal_id": "sig-20261026-pinterest-trends-growth-wow-004-roman-cyberpunk",
  "source": "pinterest_trends",
  "is_estimate": true,
  "keyword": "roman cyberpunk",
  "niche": "unassigned",
  "metric": "growth_wow",
  "value": 85.0,
  "unit": "ratio",
  "window_start": "2026-10-19",
  "window_end": "2026-10-26",
  "fetched_at": "2026-10-26T13:04:42+00:00",
  "raw_ref": "data/inbox/2026-10-26/pinterest_trends.csv",
  "license": "owner export, internal use"
 },
 {
  "signal_id": "sig-20261026-pinterest-trends-growth-mom-004-roman-cyberpunk",
  "source": "pinterest_trends",
  "is_estimate": true,
  "keyword": "roman cyberpunk",
  "niche": "unassigned",
  "metric": "growth_mom",
  "value": 100.0,
  "unit": "ratio",
  "window_start": "2026-09-26",
  "window_end": "2026-10-26",
  "fetched_at": "2026-10-26T13:04:42+00:00",
  "raw_ref": "data/inbox/2026-10-26/pinterest_trends.csv",
  "license": "owner export, internal use"
 },
 {
  "signal_id": "sig-20261026-pinterest-trends-growth-yoy-004-roman-cyberpunk",
  "source": "pinterest_trends",
  "is_estimate": true,
  "keyword": "roman cyberpunk",
  "niche": "unassigned",
  "metric": "growth_yoy",
  "value": 100.0,
  "unit": "ratio",
  "window_start": "2025-10-26",
  "window_end": "2026-10-26",
  "fetched_at": "2026-10-26T13:04:42+00:00",
  "raw_ref": "data/inbox/2026-10-26/pinterest_trends.csv",
  "license": "owner export, internal use"
 },
 {
  "signal_id": "sig-20261026-pinterest-trends-trend-rank-005-last-minute-trunk-or-tre",
  "source": "pinterest_trends",
  "is_estimate": true,
  "keyword": "last minute trunk or treat ideas",
  "niche": "unassigned",
  "metric": "trend_rank",
  "value": 5.0,
  "unit": "rank",
  "window_start": "2026-10-26",
  "window_end": "2026-10-26",
  "fetched_at": "2026-10-26T13:04:42+00:00",
  "raw_ref": "data/inbox/2026-10-26/pinterest_trends.csv",
  "license": "owner export, internal use"
 },
 {
  "signal_id": "sig-20261026-pinterest-trends-growth-wow-005-last-minute-trunk-or-tre",
  "source": "pinterest_trends",
  "is_estimate": true,
  "keyword": "last minute trunk or treat ideas",
  "niche": "unassigned",
  "metric": "growth_wow",
  "value": 1.0,
  "unit": "ratio",
  "window_start": "2026-10-19",
  "window_end": "2026-10-26",
  "fetched_at": "2026-10-26T13:04:42+00:00",
  "raw_ref": "data/inbox/2026-10-26/pinterest_trends.csv",
  "license": "owner export, internal use"
 },
 {
  "signal_id": "sig-20261026-pinterest-trends-growth-mom-005-last-minute-trunk-or-tre",
  "source": "pinterest_trends",
  "is_estimate": true,
  "keyword": "last minute trunk or treat ideas",
  "niche": "unassigned",
  "metric": "growth_mom",
  "value": 100.0,
  "unit": "ratio",
  "window_start": "2026-09-26",
  "window_end": "2026-10-26",
  "fetched_at": "2026-10-26T13:04:42+00:00",
  "raw_ref": "data/inbox/2026-10-26/pinterest_trends.csv",
  "license": "owner export, internal use"
 },
 {
  "signal_id": "sig-20261026-pinterest-trends-growth-yoy-005-last-minute-trunk-or-tre",
  "source": "pinterest_trends",
  "is_estimate": true,
  "keyword": "last minute trunk or treat ideas",
  "niche": "unassigned",
  "metric": "growth_yoy",
  "value": -0.4,
  "unit": "ratio",
  "window_start": "2025-10-26",
  "window_end": "2026-10-26",
  "fetched_at": "2026-10-26T13:04:42+00:00",
  "raw_ref": "data/inbox/2026-10-26/pinterest_trends.csv",
  "license": "owner export, internal use"
 },
 {
  "signal_id": "sig-20261026-pinterest-trends-trend-rank-006-pumpkin-patch-captions-f",
  "source": "pinterest_trends",
  "is_estimate": true,
  "keyword": "pumpkin patch captions for instagram",
  "niche": "unassigned",
  "metric": "trend_rank",
  "value": 6.0,
  "unit": "rank",
  "window_start": "2026-10-26",